{"$defs":{"finding":{"additionalProperties":false,"properties":{"blocking":{"type":"boolean"},"code":{"maxLength":128,"pattern":"^[A-Z][A-Z0-9_]*$","type":"string"},"evidence_refs":{"$ref":"#/$defs/refList"},"message":{"$ref":"#/$defs/text"},"repair_hint":{"$ref":"#/$defs/text"},"severity":{"enum":["info","warning","error"],"type":"string"}},"required":["code","severity","blocking","message","evidence_refs","repair_hint"],"type":"object"},"ref":{"maxLength":256,"minLength":1,"pattern":"^[A-Za-z0-9][A-Za-z0-9:._/@-]{0,255}$","type":"string"},"refList":{"items":{"$ref":"#/$defs/ref"},"maxItems":256,"type":"array","uniqueItems":true},"text":{"maxLength":16384,"minLength":1,"type":"string"},"textList":{"items":{"$ref":"#/$defs/text"},"maxItems":256,"type":"array","uniqueItems":true},"view":{"additionalProperties":false,"properties":{"instruction":{"$ref":"#/$defs/text"},"negative_constraints":{"$ref":"#/$defs/textList"},"view_key":{"pattern":"^view-[a-z0-9][a-z0-9-]{0,63}$","type":"string"},"view_role":{"enum":["single","front","left_profile","right_profile","back","detail","action_phase","scene","keyframe"],"type":"string"}},"required":["view_key","view_role","instruction","negative_constraints"],"type":"object"}},"$id":"urn:yeisme:schema:character_asset.prompt_bundle.v1","$schema":"https://json-schema.org/draft/2020-12/schema","additionalProperties":false,"description":"Provider-neutral visual asset prompt bundle compiled for Eikona review and execution.","properties":{"asset_profile_id":{"enum":["face-master-v1","body-master-v1","turnaround-three-view-v1","wardrobe-sheet-v1","expression-sheet-v1","action-sheet-v1","prop-scene-sheet-v1","shot-keyframe-v1","continuity-repair-v1"],"type":"string"},"findings":{"items":{"$ref":"#/$defs/finding"},"maxItems":128,"type":"array"},"global_negative_constraints":{"$ref":"#/$defs/textList"},"prompt_sections":{"additionalProperties":false,"properties":{"body":{"$ref":"#/$defs/text"},"camera_lighting":{"$ref":"#/$defs/text"},"composition_layout":{"$ref":"#/$defs/text"},"continuity":{"$ref":"#/$defs/text"},"environment_context":{"$ref":"#/$defs/text"},"identity":{"$ref":"#/$defs/text"},"pose_action":{"$ref":"#/$defs/text"},"wardrobe_material":{"$ref":"#/$defs/text"}},"required":["identity","body","wardrobe_material","pose_action","composition_layout","camera_lighting","environment_context","continuity"],"type":"object"},"qc_checklist":{"$ref":"#/$defs/textList"},"reference_policy":{"additionalProperties":false,"properties":{"identity_source_refs":{"$ref":"#/$defs/refList"},"pose_source_refs":{"$ref":"#/$defs/refList"},"style_source_refs":{"$ref":"#/$defs/refList"},"usage_summary":{"$ref":"#/$defs/text"},"wardrobe_source_refs":{"$ref":"#/$defs/refList"}},"required":["identity_source_refs","wardrobe_source_refs","style_source_refs","pose_source_refs","usage_summary"],"type":"object"},"schema_version":{"const":"character_asset.prompt_bundle.v1","type":"string"},"subject_version_ref":{"$ref":"#/$defs/ref"},"views":{"items":{"$ref":"#/$defs/view"},"maxItems":32,"minItems":1,"type":"array"}},"required":["schema_version","asset_profile_id","subject_version_ref","reference_policy","prompt_sections","views","global_negative_constraints","qc_checklist","findings"],"title":"AI Drama Character Asset Prompt Bundle v1","type":"object"}