{"asset_profile_id":"turnaround-three-view-v1","findings":[],"global_negative_constraints":["不生成未成年人","不混合第二张脸","不镜像左右 marker","不出现材料穿透或身体裸露","不增加品牌 Logo","不增加多余肢体或重复人物"],"prompt_sections":{"body":"约 7.2 头身，自然直立，全身完整入画，肩胯与四肢比例跨三格一致。","camera_lighting":"正交感弱透视全身镜头，85mm 等效视角，柔和均匀棚拍光，避免强烈轮廓光遮蔽材料。","composition_layout":"前、左侧、背三格等宽排列，同一地平线、同一镜头距离和人物占比，浅灰中性背景。","continuity":"固定左耳银钉、发型、服装层级、腰封、鞋型和旋转方向；背面不出现正面五官。","environment_context":"无叙事场景、无额外道具、无其他人物，背景只用于轮廓识别。","identity":"同一年轻成年女性，椭圆脸，黑色长发低束，左耳小银钉作为方向 marker，三视图身份完全一致。","pose_action":"三格均为中性站姿，双臂自然下垂，重心居中，不用动作遮挡身体比例。","wardrobe_material":"月白色不透明丝绸交领内衫，外罩浅烟紫半透明薄纱，胸背与腰部保持不透明内层完整覆盖，烟紫窄腰封，米白低帮帆布鞋。"},"qc_checklist":["成年身份明确","三格身份和身体比例一致","前侧背顺序正确","左右 marker 不镜像","薄纱外层有完整不透明内层覆盖","背面无正面五官","鞋型和服装层级一致","完整头脚且三格对齐"],"reference_policy":{"identity_source_refs":["reference:identity-wuxia-lan@v1"],"pose_source_refs":[],"style_source_refs":["reference:style-soft-ink-color@v1"],"usage_summary":"身份、服装与风格参考严格分工；不继承未声明的姿态、背景或品牌元素。","wardrobe_source_refs":["reference:wardrobe-moonwhite@v1"]},"schema_version":"character_asset.prompt_bundle.v1","subject_version_ref":"subject:wuxia-lan-01@v1","views":[{"instruction":"成年女性正面全身，左耳小银钉位于角色左侧，交领、腰封、薄纱外层和帆布鞋结构清楚。","negative_constraints":["不裁切头脚","不镜像 marker","不改变鞋型"],"view_key":"view-front","view_role":"front"},{"instruction":"同一角色左侧全身，保持头身比、发髻、服装层级和鞋型，侧面不露出右侧 marker。","negative_constraints":["不变成右侧视图","不增加发饰","不改变材料覆盖"],"view_key":"view-left-profile","view_role":"left_profile"},{"instruction":"同一角色背面全身，展示发束、外衫背部、腰封后侧和帆布鞋后跟，不出现正面五官或胸前交领。","negative_constraints":["背面不出现脸","不出现胸前结构","不改变鞋型"],"view_key":"view-back","view_role":"back"}]}